[
  {
    "data_sources": [
      "Vendor activity or audit logs",
      "Identity and access management systems",
      "SaaS usage reports"
    ],
    "description_md": "Measures how effectively provisioned user accounts translate into active usage by comparing the number of active users to the total number of provisioned users. The formula quantifies the proportion of accounts that are delivering ongoing value rather than simply existing in an enabled state. Higher ratios indicate strong engagement and efficient access management, while lower ratios highlight dormant or unused accounts that may be candidates for deprovisioning or licence reduction. This KPI was developed by the [FinOps for SaaS Working Group](https://www.finops.org/wg/finops-for-software-as-a-service-saas/#acknowledgments).",
    "featured_on": [
      "licensing-saas"
    ],
    "formula": "Active-to-Provisioned User Ratio = (Active Users / Provisioned Users) x 100",
    "license": "CC-BY-4.0",
    "related_capability_slugs": [
      "data-ingestion",
      "licensing-saas",
      "reporting-analytics",
      "usage-optimization"
    ],
    "slug": "active-to-provisioned-user-ratio",
    "source_url": "https://www.finops.org/kpi/active-to-provisioned-user-ratio/",
    "title": "Active-to-Provisioned User Ratio",
    "wp_id": 25782
  },
  {
    "data_sources": [
      "On-Premises Cost Data",
      "Resource Metadata",
      "ERP / Accounting Systems",
      "Audit logs"
    ],
    "description_md": "Measures the effectiveness of cost attribution practices across an organization’s infrastructure. The formula calculates the percentage of total infrastructure costs that are directly and accurately attributed to the responsible teams, projects, or business units. A higher AAI indicates better financial transparency, more reliable Chargeback or Showback, and stronger alignment between costs and consumption, supporting accurate budgeting, forecasting, and FinOps decision-making. This KPI was developed by the [FinOps for Data Center Working Group](https://www.finops.org/wg/finops-for-data-center-creating-a-finops-practice-profile/#acknowledgments).",
    "featured_on": [
      "allocation"
    ],
    "formula": "Allocation Accuracy Index (AAI) = (Directly Attributed Costs / Total Infrastructure Costs) × 100",
    "license": "CC-BY-4.0",
    "related_capability_slugs": [
      "allocation",
      "reporting-analytics",
      "usage-optimization"
    ],
    "slug": "allocation-accuracy-index-aai",
    "source_url": "https://www.finops.org/kpi/allocation-accuracy-index-aai/",
    "title": "Allocation Accuracy Index (AAI)",
    "wp_id": 25779
  },
  {
    "data_sources": [],
    "description_md": "Measures amount of carbon avoided as a result of identifying and correcting an anomaly.",
    "featured_on": [],
    "license": "CC-BY-4.0",
    "related_capability_slugs": [],
    "slug": "anomaly-detected-carbon-avoidance",
    "source_url": "https://www.finops.org/kpi/anomaly-detected-carbon-avoidance/",
    "title": "Anomaly-Detected Carbon Avoidance",
    "wp_id": 17869
  },
  {
    "data_sources": [
      "Monitoring Tools"
    ],
    "description_md": "Measures amount of cost avoidance as a result of identifying and correcting an anomaly. [See Playbook for more details](https://www.finops.org/wg/measuring-anomaly-detected-cost-avoidance-playbook/).",
    "featured_on": [
      "anomaly-management"
    ],
    "formula": "Total cost of the unpredicted & correctable amount of spend * Projected Amount of Days the anomaly could have occurred if the underlying issue was not addressed",
    "license": "CC-BY-4.0",
    "related_capability_slugs": [
      "anomaly-management"
    ],
    "slug": "anomaly-detected-cost-avoidance",
    "source_url": "https://www.finops.org/kpi/anomaly-detected-cost-avoidance/",
    "title": "Anomaly-Detected Cost Avoidance",
    "wp_id": 9641
  },
  {
    "data_sources": [
      "API usage reports",
      "Dashboards from AI platforms",
      "Logs from AI platforms",
      "Cloud billing data"
    ],
    "description_md": "Measures the frequency and cost impact of anomalies in AI spending, such as sudden cost spikes or unexpected usage patterns. This KPI enables proactive identification and mitigation of runaway costs.",
    "featured_on": [
      "anomaly-management"
    ],
    "formula": "Total Cost of Anomaly Spikes / Total AI Spend = Anomaly Cost %\nwhere (adjust for your needs):\nGreen (< 2%): Healthy. Normal fluctuations.\nYellow (2-7%): Warning. Minor anomaly trend\nRed (> 7%): Critical. You have a “runaway” costs.",
    "license": "CC-BY-4.0",
    "related_capability_slugs": [
      "anomaly-management",
      "data-ingestion",
      "reporting-analytics"
    ],
    "slug": "anomaly-detection-rate",
    "source_url": "https://www.finops.org/kpi/anomaly-detection-rate/",
    "title": "Anomaly Detection Rate",
    "wp_id": 26638
  },
  {
    "data_sources": [],
    "description_md": "Measures effectiveness of an auto-scaling system.\n\nThe goal of auto-scaling efficiency is to ensure that the right amount of resources are provisioned and de-provisioned in response to changes in demand, in order to achieve a balance between performance, cost, and resource utilization.",
    "featured_on": [
      "usage-optimization"
    ],
    "formula": "Auto-scaling efficiency rate = Maximum capacity cost of running workload to meet workload demand / Cost of running workload with auto-scaling to meet same workload demand. The higher the efficiency rate the more effective the auto-scaling is. Effective Cost can be used in this formula, or the List Cost metric can be used to eliminate the effect of discounts and focus entirely on the scaling effect.",
    "license": "CC-BY-4.0",
    "related_capability_slugs": [
      "sustainability",
      "usage-optimization"
    ],
    "slug": "auto-scaling-efficiency-rate",
    "source_url": "https://www.finops.org/kpi/auto-scaling-efficiency-rate/",
    "title": "Auto-scaling Efficiency Rate",
    "wp_id": 9647
  },
  {
    "data_sources": [],
    "description_md": "Measures the percentage of tokens used from cache. Cached tokens are significantly cheaper. A low cache hit rate signals an optimization opportunity for FinOps Practitioner and Engineering [Personas](https://www.finops.org/framework/personas/).",
    "featured_on": [],
    "license": "CC-BY-4.0",
    "related_capability_slugs": [],
    "slug": "cache-hit-rate",
    "source_url": "https://www.finops.org/kpi/cache-hit-rate/",
    "title": "Cache Hit Rate",
    "wp_id": 29467
  },
  {
    "data_sources": [],
    "description_md": "Companies will define the criteria for a low carbon region—such as areas where electricity is over 80% renewable—and assess the percentage of their resources located in these low carbon and high renewable regions.",
    "featured_on": [],
    "license": "CC-BY-4.0",
    "related_capability_slugs": [],
    "slug": "carbon-efficient-locations",
    "source_url": "https://www.finops.org/kpi/carbon-efficient-locations/",
    "title": "Carbon Efficient Locations",
    "wp_id": 17883
  },
  {
    "data_sources": [],
    "description_md": "Measure of carbon emissions (CO2e) for a period of time for compute. This metric helps organizations understand the environmental impact of cloud compute usage and make decisions to reduce their carbon footprint by choosing more efficient or renewable-energy-powered compute options.",
    "featured_on": [],
    "license": "CC-BY-4.0",
    "related_capability_slugs": [],
    "slug": "carbon-per-time-compute-category",
    "source_url": "https://www.finops.org/kpi/carbon-per-time-compute-category/",
    "title": "Carbon per [Time] Compute Category",
    "wp_id": 17881
  },
  {
    "data_sources": [],
    "description_md": "Measure of carbon emissions (CO2e) for a period of time by gigabytes of storage capacity. This metric helps organizations understand the environmental impact of cloud storage usage and make decisions to reduce their carbon footprint by choosing more efficient or renewable-energy-powered storage options.",
    "featured_on": [],
    "license": "CC-BY-4.0",
    "related_capability_slugs": [],
    "slug": "carbon-per-time-storage-category",
    "source_url": "https://www.finops.org/kpi/carbon-per-time-storage-category/",
    "title": "Carbon per [Time] Storage Category",
    "wp_id": 17872
  },
  {
    "data_sources": [
      "Total Carbon Emissions: CSP Carbon Footprint Tool/Dashboard or Sustainability Calculator",
      "Total Resource Usage: CSP Billing & Cost Management Tool/Dashboard"
    ],
    "description_md": "Carbon emissions per unit of cloud service SKU measure the amount of carbon dioxide equivalent (CO2e) emitted to deliver a specific unit of cloud services, such as compute, storage, and/or networking. This metric allows businesses and consumers to track the environmental impact of cloud usage by resource and make decisions to reduce their carbon footprint by choosing more efficient or renewable-energy-powered solutions.",
    "featured_on": [
      "sustainability"
    ],
    "formula": "Carbon per unit (kgCO2e) = Total Carbon Emissions (kgCO2e) / Total Resource Usage (SKU)\nAdditional Guidance:\nTotal Carbon Emissions: The total emissions generated by the datacenter operations, including energy usage, cooling, hardware production, and more, typically reported in kilograms of CO2 equivalent (kgCO2e). Can be identified by location or region, depending if CSP supports carbon reporting as market-based or location-based.\nTotal Resource Usage: This represents the total consumption of the specific cloud resource, such as CPU hours, GB of storage, or data transfer in GB, for the specific cloud services with a SKU.",
    "license": "CC-BY-4.0",
    "related_capability_slugs": [
      "intersecting-disciplines",
      "sustainability",
      "unit-economics"
    ],
    "slug": "carbon-per-unit-of-cloud-service-sku",